title,summary,link,published,source
"Social Security’s new commissioner, rule reversals and cost cuts: Here’s everything that’s happening at the agency","A Social Security “war room,” threats to shut the agency, worker buyouts and a restraining order — here’s a timeline of what has taken place so far this year.",https://www.marketwatch.com/story/social-security-under-pressure-heres-whats-happening-now-f0c4b44a?mod=mw_rss_topstories,"Tue, 08 Jul 2025 13:58:00 GMT",https://feeds.content.dowjones.io/public/rss/mw_topstories
How to use AI to find the best Amazon Prime Day deals,"More consumers are using artificial intelligence to shop, and generative-AI models can help shoppers find the best deals this Prime Day.",https://www.marketwatch.com/story/how-to-use-ai-to-find-the-best-amazon-prime-day-deals-6dedb8c9?mod=mw_rss_topstories,"Tue, 08 Jul 2025 13:16:00 GMT",https://feeds.content.dowjones.io/public/rss/mw_topstories
Treasury rout grows as tariffs and supply test demand after tax and spending bill,U.S. government debt will face a crucial test from investors this week as it readies a series of Treasury auctions,https://www.marketwatch.com/story/treasury-rout-grows-as-tariffs-and-supply-test-demand-after-tax-and-spending-bill-cd602515?mod=mw_rss_topstories,"Tue, 08 Jul 2025 13:10:00 GMT",https://feeds.content.dowjones.io/public/rss/mw_topstories
Goldman Sachs lifts its S&P 500 forecasts. Strategists say these three investment moves are crucial.,"Goldman say resilient earnings, earlier and bigger Fed rate cuts and more investor buying of stocks will drive the S&amp;P 500 higher from here.",https://www.marketwatch.com/story/goldman-sachs-lifts-its-s-p-500-forecasts-strategists-say-these-three-investment-moves-are-crucial-c7d2a661?mod=mw_rss_topstories,"Tue, 08 Jul 2025 13:08:00 GMT",https://feeds.content.dowjones.io/public/rss/mw_topstories
"WeightWatchers emerges from bankruptcy, and it’s now taking aim at menopause",WeightWatchers’ stock was surging after the company emerged from bankruptcy two months after it was announced.,https://www.marketwatch.com/story/weightwatchers-emerges-from-bankruptcy-and-is-taking-aim-at-menopause-96661116?mod=mw_rss_topstories,"Tue, 08 Jul 2025 13:08:00 GMT",https://feeds.content.dowjones.io/public/rss/mw_topstories
"Here’s what is most likely to cause a summer market crisis, according to Deutsche Bank","With thin liquidity and lots of market players absent, the third quarter can often be accompanied by market turmoil.",https://www.marketwatch.com/story/market-crises-are-most-common-in-the-summer-deutsche-bank-identifies-the-most-likely-culprits-if-there-was-one-this-time-9df28fa1?mod=mw_rss_topstories,"Tue, 08 Jul 2025 12:12:00 GMT",https://feeds.content.dowjones.io/public/rss/mw_topstories
How Trump’s budget is gambling with your savings and investments,Investor assumptions that wealth will continuously increase is about to be tested.,https://www.marketwatch.com/story/how-trumps-budget-is-gambling-with-your-savings-and-investments-ac8436fc?mod=mw_rss_topstories,"Tue, 08 Jul 2025 11:50:00 GMT",https://feeds.content.dowjones.io/public/rss/mw_topstories
Here’s why Enphase and other solar stocks are tanking after Trump’s latest move,The maker of solar-power components saw its stock downgraded after Trump’s executive order enforcing a phaseout of tax credits.,https://www.marketwatch.com/story/heres-why-enphase-and-other-solar-stocks-are-tanking-after-trumps-latest-move-fdd2be69?mod=mw_rss_topstories,"Tue, 08 Jul 2025 11:50:00 GMT",https://feeds.content.dowjones.io/public/rss/mw_topstories
Here’s the open secret as U.S. tightens sanctions on Iran’s oil exports,"The U.S. continues to show it’s serious about punishing Iran for its nuclear ambitions and support for terrorism, but tighter sanctions on Tehran risk being a shot in the foot for America’s plans to keep crude-oil prices low.",https://www.marketwatch.com/story/heres-the-open-secret-as-u-s-tightens-sanctions-on-irans-oil-exports-31eadab5?mod=mw_rss_topstories,"Tue, 08 Jul 2025 11:30:00 GMT",https://feeds.content.dowjones.io/public/rss/mw_topstories
Citi and JPMorgan signal elevated risks of profit taking,"Research updates on investor positioning from JPMorgan and Citi indicate that bullish exposure is high, potentially setting up the circumstances for a near-term correction in U.S. risk assets.",https://www.marketwatch.com/story/citi-and-jpmorgan-signal-elevated-risks-of-profit-taking-fe566a07?mod=mw_rss_topstories,"Tue, 08 Jul 2025 10:00:00 GMT",https://feeds.content.dowjones.io/public/rss/mw_topstories
Elon Musk in a post on X says some of his Trump posts ‘went too far’ and that he regrets them,,https://www.marketwatch.com/story/elon-musk-in-a-post-on-x-says-some-of-his-trump-posts-went-too-far-and-that-he-regrets-them-90e73a6a?mod=mw_rss_realtimeheadlines,"Wed, 11 Jun 2025 07:09:00 GMT",https://feeds.content.dowjones.io/public/rss/mw_realtimeheadlines
"Bank of England decision on Thursday will be at 12:02 p.m. local time instead of 12 p.m., due to VE Day’s two minutes of silence",,https://www.marketwatch.com/story/bank-of-england-decision-on-thursday-will-be-at-12-02-p-m-local-time-instead-of-12-p-m-due-to-ve-day-two-minutes-of-silence-1f6bed66?mod=mw_rss_realtimeheadlines,"Tue, 06 May 2025 11:59:00 GMT",https://feeds.content.dowjones.io/public/rss/mw_realtimeheadlines
Swiss National Bank cuts interest rates by a half point to 0.5%,,https://www.marketwatch.com/story/swiss-national-bank-cuts-interest-rates-by-a-half-point-to-0-5-ed1fce78?mod=mw_rss_realtimeheadlines,"Thu, 12 Dec 2024 08:32:00 GMT",https://feeds.content.dowjones.io/public/rss/mw_realtimeheadlines
Dollar jumps 0.5% to 0.8890 francs,,https://www.marketwatch.com/story/dollar-jumps-0-5-to-0-8890-francs-047c6b4d?mod=mw_rss_realtimeheadlines,"Thu, 12 Dec 2024 08:32:00 GMT",https://feeds.content.dowjones.io/public/rss/mw_realtimeheadlines
Germany flash manufacturing PMI rises to 4-month high of 43.2,,https://www.marketwatch.com/story/germany-flash-manufacturing-pmi-rises-to-4-month-high-of-43-2-b9e50a64?mod=mw_rss_realtimeheadlines,"Fri, 22 Nov 2024 08:34:00 GMT",https://feeds.content.dowjones.io/public/rss/mw_realtimeheadlines
Germany flash services PMI falls to 9-month low of 49.4,,https://www.marketwatch.com/story/germany-flash-services-pmi-falls-to-9-month-low-of-49-4-5e5d2763?mod=mw_rss_realtimeheadlines,"Fri, 22 Nov 2024 08:34:00 GMT",https://feeds.content.dowjones.io/public/rss/mw_realtimeheadlines
Powell says labor market not a source of significant inflation pressure,,https://www.marketwatch.com/story/powell-says-labor-market-not-a-source-of-significant-inflation-pressure-cc3b1297?mod=mw_rss_realtimeheadlines,"Wed, 31 Jul 2024 18:48:00 GMT",https://feeds.content.dowjones.io/public/rss/mw_realtimeheadlines
Fed’s Powell says rate cut ‘on the table’ as soon as September,,https://www.marketwatch.com/story/feds-powell-says-rate-cut-on-the-table-as-soon-as-september-f3f7c8f2?mod=mw_rss_realtimeheadlines,"Wed, 31 Jul 2024 18:41:00 GMT",https://feeds.content.dowjones.io/public/rss/mw_realtimeheadlines
Final S&P U.S. manufacturing index is 52.2 in February vs. initial 51.5,,https://www.marketwatch.com/story/final-s-p-u-s-manufacturing-index-is-52-2-in-february-vs-initial-51-5-180b7107?mod=mw_rss_realtimeheadlines,"Fri, 01 Mar 2024 14:47:00 GMT",https://feeds.content.dowjones.io/public/rss/mw_realtimeheadlines
Duolingo started at buy with $222 price target at Seaport,,https://www.marketwatch.com/story/duolingo-started-at-buy-with-222-price-target-at-seaport-f762126a?mod=mw_rss_realtimeheadlines,"Tue, 27 Feb 2024 12:40:00 GMT",https://feeds.content.dowjones.io/public/rss/mw_realtimeheadlines
Jobless claims fall to lowest level since mid-May,,https://www.marketwatch.com/story/jobless-claims-fall-to-lowest-level-since-mid-may-bda58e3b?mod=mw_rss_marketpulse,"Thu, 03 Jul 2025 12:36:00 GMT",https://feeds.content.dowjones.io/public/rss/mw_marketpulse
Jobless claims stay low in latest week,,https://www.marketwatch.com/story/jobless-claims-stay-low-in-latest-week-27b4b50b?mod=mw_rss_marketpulse,"Thu, 13 Feb 2025 13:33:00 GMT",https://feeds.content.dowjones.io/public/rss/mw_marketpulse
Consumer credit growth soars in December,,https://www.marketwatch.com/story/consumer-credit-growth-soars-in-december-d405d18e?mod=mw_rss_marketpulse,"Fri, 07 Feb 2025 20:26:00 GMT",https://feeds.content.dowjones.io/public/rss/mw_marketpulse
U.S. productivity slows down in fourth quarter while unit labor costs accelerate,,https://www.marketwatch.com/story/u-s-productivity-slows-down-in-fourth-quarter-while-unit-labor-costs-accelerate-3c2b9092?mod=mw_rss_marketpulse,"Thu, 06 Feb 2025 13:34:00 GMT",https://feeds.content.dowjones.io/public/rss/mw_marketpulse
Beyond to buy rights to Buy Buy Baby brand and reunite it with Bed Bath & Beyond,,https://www.marketwatch.com/story/beyond-to-buy-rights-to-buy-buy-baby-brand-and-reunite-it-with-bed-bath-beyond-4383c6be?mod=mw_rss_marketpulse,"Mon, 03 Feb 2025 13:46:00 GMT",https://feeds.content.dowjones.io/public/rss/mw_marketpulse
Trump asks Supreme Court to pause TikTok ban,,https://www.marketwatch.com/story/trump-asks-supreme-court-to-pause-tiktok-ban-2b724ae6?mod=mw_rss_marketpulse,"Sat, 28 Dec 2024 00:32:00 GMT",https://feeds.content.dowjones.io/public/rss/mw_marketpulse
Amazon says it had best-ever Thanksgiving Holiday week with record sales and number of items sold,,https://www.marketwatch.com/story/amazon-says-it-had-best-ever-thanksgiving-holiday-week-with-record-sales-and-number-of-items-sold-786e0143?mod=mw_rss_marketpulse,"Tue, 03 Dec 2024 14:05:00 GMT",https://feeds.content.dowjones.io/public/rss/mw_marketpulse
U.S. stock futures and bond yields drop on reports Putin has updated nuclear doctrine,,https://www.marketwatch.com/story/u-s-stock-futures-and-bond-yields-drop-on-reports-putin-has-updated-nuclear-doctrine-4b9792c4?mod=mw_rss_marketpulse,"Tue, 19 Nov 2024 08:55:00 GMT",https://feeds.content.dowjones.io/public/rss/mw_marketpulse
Charter Communications announces buyout deal for Liberty Broadband at terms above its previous proposal,,https://www.marketwatch.com/story/charter-communications-announces-buyout-deal-for-liberty-broadband-at-terms-above-its-previous-proposal-552f7acd?mod=mw_rss_marketpulse,"Wed, 13 Nov 2024 13:52:00 GMT",https://feeds.content.dowjones.io/public/rss/mw_marketpulse
General Motors unveils new all-electric Cadillac called the Vistiq with 300-mile range,,https://www.marketwatch.com/story/general-motors-unveils-new-all-electric-cadillac-called-the-vistiq-with-300-mile-range-c16fb8a6?mod=mw_rss_marketpulse,"Tue, 12 Nov 2024 13:53:00 GMT",https://feeds.content.dowjones.io/public/rss/mw_marketpulse
Vestas Wind Systems stock slumps as company says margins to be at low end of guidance,,https://www.marketwatch.com/story/vestas-wind-systems-stock-slumps-as-company-says-margins-to-be-at-low-end-of-guidance-a33bf5c4?mod=mw_rss_marketpulse,"Tue, 05 Nov 2024 08:39:00 GMT",https://feeds.content.dowjones.io/public/rss/mw_marketpulse
Burberry shares rise on report Moncler could bid for it,,https://www.marketwatch.com/story/burberry-shares-rise-on-report-moncler-could-bid-for-it-9de42b98?mod=mw_rss_marketpulse,"Mon, 04 Nov 2024 08:36:00 GMT",https://feeds.content.dowjones.io/public/rss/mw_marketpulse
Kazatomprom reports 17% increase in production during the third quarter,,https://www.marketwatch.com/story/kazatomprom-reports-17-increase-in-production-during-the-third-quarter-68742d5c?mod=mw_rss_marketpulse,"Fri, 01 Nov 2024 07:36:00 GMT",https://feeds.content.dowjones.io/public/rss/mw_marketpulse
Anheuser-Busch InBev shares slip as sales come up shy of estimates,,https://www.marketwatch.com/story/anheuser-busch-inbev-shares-slip-as-sales-come-up-shy-of-estimates-508282c4?mod=mw_rss_marketpulse,"Thu, 31 Oct 2024 08:09:00 GMT",https://feeds.content.dowjones.io/public/rss/mw_marketpulse
Wingstop’s stock slides 12% after profit falls short of estimates,,https://www.marketwatch.com/story/wingstops-stock-slides-12-after-profit-falls-short-of-estimates-1146f0ec?mod=mw_rss_marketpulse,"Wed, 30 Oct 2024 12:22:00 GMT",https://feeds.content.dowjones.io/public/rss/mw_marketpulse
Novartis hikes sales and profit guidance for the year,,https://www.marketwatch.com/story/novartis-hikes-sales-and-profit-guidance-for-the-year-eed24ebf?mod=mw_rss_marketpulse,"Tue, 29 Oct 2024 07:08:00 GMT",https://feeds.content.dowjones.io/public/rss/mw_marketpulse
Plus500 says it will meet expectations after quarterly revenue climbs 11%,,https://www.marketwatch.com/story/plus500-says-it-will-meet-expectations-after-quarterly-revenue-climbs-11-b68b5ef1?mod=mw_rss_marketpulse,"Mon, 28 Oct 2024 07:14:00 GMT",https://feeds.content.dowjones.io/public/rss/mw_marketpulse
Trainline boosts guidance for the second time this year,,https://www.marketwatch.com/story/trainline-boosts-guidance-for-the-second-time-this-year-513373f6?mod=mw_rss_marketpulse,"Mon, 28 Oct 2024 07:08:00 GMT",https://feeds.content.dowjones.io/public/rss/mw_marketpulse
Barclays reports 18% profit rise as it lifts income guidance,,https://www.marketwatch.com/story/barclays-reports-18-profit-rise-as-it-lifts-income-guidance-ceef3caf?mod=mw_rss_marketpulse,"Thu, 24 Oct 2024 06:41:00 GMT",https://feeds.content.dowjones.io/public/rss/mw_marketpulse
"London Stock Exchange Group says income grew, led by Tradeweb",,https://www.marketwatch.com/story/london-stock-exchange-group-says-income-grew-led-by-tradeweb-65d00f97?mod=mw_rss_marketpulse,"Thu, 24 Oct 2024 06:28:00 GMT",https://feeds.content.dowjones.io/public/rss/mw_marketpulse
Nobel economics prize awarded to three who studied wealth of nations,,https://www.marketwatch.com/story/nobel-economics-prize-awarded-to-three-who-studied-wealth-of-nations-b1a391ba?mod=mw_rss_marketpulse,"Mon, 14 Oct 2024 09:53:00 GMT",https://feeds.content.dowjones.io/public/rss/mw_marketpulse
Nobel Peace Prize awarded to Japanese atomic bomb survivors,,https://www.marketwatch.com/story/nobel-peace-prize-awarded-to-japanese-atomic-bomb-survivors-d14639d7?mod=mw_rss_marketpulse,"Fri, 11 Oct 2024 09:05:00 GMT",https://feeds.content.dowjones.io/public/rss/mw_marketpulse
DirecTV to acquire EchoStar’s video distribution business including Dish TV and Sling TV,,https://www.marketwatch.com/story/directv-to-acquire-echostars-video-distribution-business-including-dish-tv-and-sling-tv-23349832?mod=mw_rss_marketpulse,"Mon, 30 Sep 2024 11:15:00 GMT",https://feeds.content.dowjones.io/public/rss/mw_marketpulse
Moody’s places all of Boeing’s ratings on review for a downgrade,,https://www.marketwatch.com/story/moodys-places-all-of-boeings-ratings-on-review-for-a-downgrade-be242697?mod=mw_rss_marketpulse,"Fri, 13 Sep 2024 17:02:00 GMT",https://feeds.content.dowjones.io/public/rss/mw_marketpulse
Microsoft to lay off 650 people from videogame business: WSJ,,https://www.marketwatch.com/story/microsoft-to-lay-off-650-people-from-videogame-business-wsj-72135ba9?mod=mw_rss_marketpulse,"Thu, 12 Sep 2024 11:47:00 GMT",https://feeds.content.dowjones.io/public/rss/mw_marketpulse
"ArcBest misses profit expectations, as soft rate environment weighed on revenue",,https://www.marketwatch.com/story/arcbest-misses-profit-expectations-as-soft-rate-environment-weighed-on-revenue-4461160b?mod=mw_rss_marketpulse,"Fri, 02 Aug 2024 10:14:00 GMT",https://feeds.content.dowjones.io/public/rss/mw_marketpulse
Alibaba stock climbs on report of vendor service fee increase,,https://www.marketwatch.com/story/alibaba-stock-climbs-on-report-of-vendor-service-fee-increase-db9d1854?mod=mw_rss_marketpulse,"Mon, 29 Jul 2024 11:43:00 GMT",https://feeds.content.dowjones.io/public/rss/mw_marketpulse
"European stocks open lower after weak Wall Street finish, computer outages",,https://www.marketwatch.com/story/european-stocks-open-lower-after-weak-wall-street-finish-computer-outages-a57c53a7?mod=mw_rss_marketpulse,"Fri, 19 Jul 2024 07:08:00 GMT",https://feeds.content.dowjones.io/public/rss/mw_marketpulse
Wholesale inventories in U.S. rise 0.1% in April,,https://www.marketwatch.com/story/wholesale-inventories-in-u-s-rise-0-1-in-april-36e6a92d?mod=mw_rss_marketpulse,"Fri, 07 Jun 2024 14:14:00 GMT",https://feeds.content.dowjones.io/public/rss/mw_marketpulse
Hibbett shares fall as Q1 sales miss analysts’ estimate,,https://www.marketwatch.com/story/hibbett-shares-fall-as-q1-sales-miss-analysts-estimate-801a7cb0?mod=mw_rss_marketpulse,"Wed, 05 Jun 2024 11:34:00 GMT",https://feeds.content.dowjones.io/public/rss/mw_marketpulse
The Entrepreneurial Spirit of the RIA Community,"Nasdaq TradeTalks explores how innovation is redefining financial protection across industries and Brian Francetich, President & Partner of Golsan Scruggs, shares his insights on how the RIA space will evolve.",https://www.nasdaq.com/articles/entrepreneurial-spirit-ria-community,"Thu, 03 Jul 2025 13:15:00 +0000",https://www.nasdaq.com/feed/nasdaq-original/rss.xml
"June, Second Quarter 2025 Review and Outlook","This year has been nothing short of a wild ride for U.S. equities, starting with the S&amp;P 500 declining more than 21% from its February high into the low reached during the second week of April.",https://www.nasdaq.com/articles/june-second-quarter-2025-review-and-outlook,"Tue, 01 Jul 2025 19:30:00 +0000",https://www.nasdaq.com/feed/nasdaq-original/rss.xml
Analyzing the Russell Indexes Last Annual Reconstitution,"Friday, June 27, will be the last annual Russel Reconstitution before the index provider switches to reconstitutions twice a year. It’s likely that we’ll see near $200 billion trade around the close as index tracking funds buy Russell U.S. Index additions and sell deletions.",https://www.nasdaq.com/articles/analyzing-russell-indexes-last-annual-reconstitution,"Thu, 26 Jun 2025 21:25:28 +0000",https://www.nasdaq.com/feed/nasdaq-original/rss.xml
3 Forces Driving the Energy Transition,"Nasdaq TradeTalks explores the next steps of the GENIUS Act and Brian Nelson, Renewables Segment Leader at ABB, outlines the three forces fueling the energy transition.",https://www.nasdaq.com/articles/3-forces-driving-energy-transition,"Thu, 26 Jun 2025 13:05:52 +0000",https://www.nasdaq.com/feed/nasdaq-original/rss.xml
Regulatory Roundup: Price Support or Market Manipulation? Understanding Legal vs. Illegal Stock Interventions,"Discover the intricate dynamics of legal and illegal stock interventions, exploring recent cases from Canada and South Korea to understand how price support can influence market outcomes.",https://www.nasdaq.com/articles/fintech/regulatory-roundup-june-2025,"Wed, 25 Jun 2025 13:29:33 +0000",https://www.nasdaq.com/feed/nasdaq-original/rss.xml
Building a Resilient Supply Chain for Critical Minerals,"Nasdaq TradeTalks explore the future and security of the digital asset ecosystem and Roshan Pujari, Founder & CEO, Stardust Power, highlights the importance of building a resilient, domestic supply chain for critical minerals.",https://www.nasdaq.com/articles/building-resilient-supply-chain-critical-minerals,"Mon, 23 Jun 2025 13:12:00 +0000",https://www.nasdaq.com/feed/nasdaq-original/rss.xml
Takeaways From SuperReturn International 2025,"We joined over 6,000 peers from 80+ countries at SuperReturn International 2025 in Berlin. The week provided valuable insights from industry leaders during this dynamic period for the private market. 

Here are my highlights and main takeaways from the week:",https://www.nasdaq.com/articles/takeaways-superreturn-international-2025,"Tue, 17 Jun 2025 17:41:18 +0000",https://www.nasdaq.com/feed/nasdaq-original/rss.xml
The 2025 Intern’s Guide to Trading,"We recently updated our Intern’s Guide to the Market Structure Galaxy. Today, we graduate to how trading works.",https://www.nasdaq.com/articles/2025-interns-guide-trading,"Tue, 17 Jun 2025 15:15:36 +0000",https://www.nasdaq.com/feed/nasdaq-original/rss.xml
Ushering in a New Era for Nuclear Energy,"Nasdaq TradeTalks delves into the increased demand for alternative investment strategies and John Vonglis, Executive Director of Global Government Affairs at Nano Nuclear Energy, shares his outlook for nuclear energy.",https://www.nasdaq.com/articles/ushering-new-era-nuclear-energy,"Mon, 16 Jun 2025 13:40:49 +0000",https://www.nasdaq.com/feed/nasdaq-original/rss.xml
Leading the Next Wave of Commerce,"Nasdaq TradeTalks explores the crucial role of cross-border joint ventures and alliances, global trade, localization and digital ecosystems. Ron Earley, CEO of Greywolfe Investing, also shares how emerging technologies are poised to impact e-commerce.",https://www.nasdaq.com/articles/leading-next-wave-commerce,"Mon, 09 Jun 2025 13:15:11 +0000",https://www.nasdaq.com/feed/nasdaq-original/rss.xml
The 2025 Intern’s Guide to the Market Structure Galaxy,"It’s that time of year again when many of us have interns joining the desk. This week, we update our annual guide to the market structure galaxy.",https://www.nasdaq.com/articles/2025-interns-guide-market-structure-galaxy,"Thu, 05 Jun 2025 21:55:31 +0000",https://www.nasdaq.com/feed/nasdaq-original/rss.xml
May 2025 Review and Outlook,U.S. equities were broadly higher in May amid the de-escalation of tariffs between the U.S. and China.,https://www.nasdaq.com/articles/may-2025-review-and-outlook,"Mon, 02 Jun 2025 18:20:57 +0000",https://www.nasdaq.com/feed/nasdaq-original/rss.xml
Reshaping How Businesses Compete in the Digital Economy,"Nasdaq TradeTalks explores why stablecoins are poised to play a central role in shaping the future of capital markets and Manish Sood, CEO & Founder of Reltio, explains how AI is reshaping how businesses compete in the digital economy.",https://www.nasdaq.com/articles/reshaping-how-businesses-compete-digital-economy,"Mon, 02 Jun 2025 13:10:00 +0000",https://www.nasdaq.com/feed/nasdaq-original/rss.xml
Healthy Equity Markets Boost Economic Growth,"Is it a surprise that all of the countries with sizable stock markets are also wealthy economies? Intuitively, efficient financial markets should help companies finance growth, which, in turn, makes the economy bigger. A recent paper seems to confirm it.",https://www.nasdaq.com/articles/healthy-equity-markets-boost-economic-growth,"Thu, 29 May 2025 21:35:00 +0000",https://www.nasdaq.com/feed/nasdaq-original/rss.xml
Regulatory Roundup: Beyond the 9-to-5: Navigating Extended Hours Trading,"Explore the dynamics and risks of extended and 24-hour trading, and discover how compliance teams can enhance their systems to manage market challenges outside traditional hours.",https://www.nasdaq.com/articles/fintech/regulatory-roundup-may-2025,"Wed, 28 May 2025 20:10:43 +0000",https://www.nasdaq.com/feed/nasdaq-original/rss.xml
ANET Quantitative Stock Analysis - Martin Zweig,"Below is Validea's guru fundamental report for ARISTA NETWORKS INC (ANET). Of the 22 guru strategies we follow,  ANET rates highest using our Growth Investor model based on the published strategy of Martin Zweig. This strategy looks for growth stocks with persistent accelerating",https://www.nasdaq.com/articles/anet-quantitative-stock-analysis-martin-zweig,"Tue, 08 Jul 2025 14:01:21 +0000",https://www.nasdaq.com/feed/rssoutbound?category=Investing%20Ideas
MCD Quantitative Stock Analysis,"Below is Validea's guru fundamental report for MCDONALD'S CORP (MCD). Of the 22 guru strategies we follow,  MCD rates highest using our Multi-Factor Investor model based on the published strategy of Pim van Vliet. This multi-factor model seeks low volatility stocks that also have",https://www.nasdaq.com/articles/mcd-quantitative-stock-analysis-1,"Tue, 08 Jul 2025 14:01:21 +0000",https://www.nasdaq.com/feed/rssoutbound?category=Investing%20Ideas
PM Quantitative Stock Analysis,"Below is Validea's guru fundamental report for PHILIP MORRIS INTERNATIONAL INC. (PM). Of the 22 guru strategies we follow,  PM rates highest using our Multi-Factor Investor model based on the published strategy of Pim van Vliet. This multi-factor model seeks low volatility stocks",https://www.nasdaq.com/articles/pm-quantitative-stock-analysis-1,"Tue, 08 Jul 2025 14:01:20 +0000",https://www.nasdaq.com/feed/rssoutbound?category=Investing%20Ideas
OKLO Quantitative Stock Analysis,"Below is Validea's guru fundamental report for OKLO INC (OKLO). Of the 22 guru strategies we follow,  OKLO rates highest using our Small-Cap Growth Investor model based on the published strategy of Motley Fool. This strategy looks for small cap growth stocks with solid fundamenta",https://www.nasdaq.com/articles/oklo-quantitative-stock-analysis-0,"Tue, 08 Jul 2025 14:01:20 +0000",https://www.nasdaq.com/feed/rssoutbound?category=Investing%20Ideas
PANW Quantitative Stock Analysis,"Below is Validea's guru fundamental report for PALO ALTO NETWORKS INC (PANW). Of the 22 guru strategies we follow,  PANW rates highest using our P/B Growth Investor model based on the published strategy of Partha Mohanram. This growth model looks for low book-to-market stocks tha",https://www.nasdaq.com/articles/panw-quantitative-stock-analysis-1,"Tue, 08 Jul 2025 14:01:20 +0000",https://www.nasdaq.com/feed/rssoutbound?category=Investing%20Ideas
BLK Quantitative Stock Analysis - Warren Buffett,"Below is Validea's guru fundamental report for BLACKROCK INC (BLK). Of the 22 guru strategies we follow,  BLK rates highest using our Patient Investor model based on the published strategy of Warren Buffett. This strategy seeks out firms with long-term, predictable profitability",https://www.nasdaq.com/articles/blk-quantitative-stock-analysis-warren-buffett,"Tue, 08 Jul 2025 14:01:20 +0000",https://www.nasdaq.com/feed/rssoutbound?category=Investing%20Ideas
