title,summary,link,published,source
3 Key Themes from Fastmarkets' 2025 Lithium Supply & Battery Raw Materials Event,"Market volatility, Chinese control, supply chain risk mitigation and financing emerged as some of the most prevalent themes at the 2025 Fastmarket’s Lithium Supply Battery Raw Materials (LBRM) conference in Las Vegas.The event, which is in its 17th year, drew a crowd of roughly 1000 delegates, industry experts and analysts, to discuss the current landscape and future projections of the battery materials sector. During his opening remarks, Fastmarkets CEO Raju Daswani highlighted the growth and maturation the battery raw materials sector has experienced.“We meet here at an extraordinary moment, the global lithium and battery materials industry is no longer a niche … It is now central to energy security, to industrial policy and to geopolitical strategy,” he said.
  
  
  INN is live from Las Vegas at @Fastmarkets' Lithium Supply &amp; Battery Raw Materials Conference! This year's event features 1,000 attendees and 543 companies. Stay tuned for our coverage.#Lithium #BatteryMetals pic.twitter.com/yvh7CPVJm1— Resource Investing (@INN_Resource) June 25, 2025 Daswani then went on to set the tone for the conference by posing four key questions about the current market designed to guide attendees' thinking throughout the event.Decoupling vs. Interdependence: Can the US and China truly decouple their lithium and battery supply chains, or will market realities force continued interdependence?Technology Leadership Race: Who will lead battery innovation?Price Sustainability: How sustainable is the current lithium price environment?Hidden Supply Chain Risks: What proactive steps can the industry take to address emerging risks like permitting delays, power constraints, community opposition, water limitations, talent shortages, and geopolitical instability in critical mining regions?These questions framed the agenda for the four day event while also underscoring some of the key challenges and strategic considerations facing the global lithium and battery raw materials industry.

  
  ​Robust growth projections
  China’s dominance in the battery metals space was a central theme at the conference and explored via a variety of angels including supply and demand dynamics, growth projections and collaboration.At the “Lithium Market Outlook 2025–2035: Navigating Demand Across EVs, Storage, and Strategic Sectors” presentation, Paul Lusty, head of battery raw materials at Fastmarkets painted a bullish picture for the future of lithium prices, despite the current challenges the market is facing.

  
  
  #EV paradox? Paul Lusty of @Fastmarkets explains that EV sales are slower than expected, but still remain robust on a year-on-year basis.#Investing #ElectricVehicles #BatteryMetals pic.twitter.com/a2REfTQz86— Resource Investing (@INN_Resource) June 25, 2025 We're facing headwinds, no doubt, and we're also seeing quite a lot of negative or bearish sentiment widespread in the market, and I think at times, it's amplified by voices that really overlooked the phenomenal levels of demand that we're seeing in many aspects of the market,” he said.Although prices have floundered since 2022, the Fastmarkets team is projecting a 12 percent CAGR through to 2035.“The long term outcome looks incredibly bullish and very compelling, the fundamentals are really still very strong, and these are anchored in some very powerful, mega trends that we see developing within the global economy.”These trends include the urgent drive for climate change mitigation, the once in a generational shift in the global energy system, and the rise of energy intensive technologies such as artificial intelligence.

  
  ​China's place in western supply
  As Daswani noted in his opening remarks China’s role in the battery metal sector was a recurring topic at the conference, with several speakers and panelists weighing in.In one of the most compelling panels “Decoding the China Playbook"", panelists recounted the country’s nearly two decade long strategy to develop a robust, vertically integrated supply chain.Iggy Tan, chairman of Lithium Universe (ASX:LU7,OTCPink:LUVSF), told the crowd China’s dominance in the battery metals sector began with a national goal of lowering vehicle emissions in the cities.“(The) strategy was to reduce pollution in the cities, and that started the battery revolution,” he said of the nation’s switch to electric scooters and cars.Additionally, the decision was further supported by a long term mandate.“With the 15 year plan, government regulations, incentives, and investment started to flow according to the plan,” said Tan. “One of the downsides with Western economies is that (the government) changes every four years, whereas in China, the plan is just updated, and you can make long term investments in this area.”

  
  
  .@globallithium recounts how #China overtook #Japan's #lithium battery production in the early 2000s. &quot;It's like Survivor — they outplayed, outwitted and outlasted,&quot; he said at @Fastmarkets' &quot;Decoding China Playbook&quot; panel. #Investing #Lithium pic.twitter.com/xagbLhBBAC— Resource Investing (@INN_Resource) June 26, 2025 As Joe Lowry, president of Global Lithium (ASX:GL1,OTCPink:GBLRF) and widely considered ""Mr. Lithium"", added the battery supply chain in China, was further strengthened in 2003 when then president Hu Jintao selected the battery industry among his 10 Champion Industries.Over the two decades since the Asian nation has invested heavily up and down the supply chain.“If it was a TV show, it would be Survivor. China, outplayed, outwitted, and outlasted their competition,” said Lowry.

  
  ​Financing the future
  As with most cyclical commodities once lithium prices began to fall financing and investment also declined. Although the long term demand outlook is poised to benefit from battery sector expansion and energy storage system growth, the current glut in the market has created a challenge for Western companies.This was reiterated by SC Insights Founder and Managing Director Andy Leyland, who used a colour coded chart to explain the discrepancy.

  
  
  .@andyleyland1 of @SCInsightsLLC takes the stage at @Fastmarkets to present his #lithium price rainbow chart, highlighting the discrepancy in production relative to the lithium price.#Investing #BatteryMetals pic.twitter.com/UkRVlQqB3q— Resource Investing (@INN_Resource) June 26, 2025 Leyland noted that at current low lithium prices (around US$7,000 per ton), companies are not making final investment decisions (FIDs) for new lithium projects.Additionally over the past 12 months, hardly any FIDs have been happening in the industry. This is because at such low price levels, most projects are not financially viable.Producers are cutting back on capital expenditures and are unable to justify new investments. The low prices make it economically challenging for companies to move forward with new lithium production projects, effectively freezing new developments in the sector.This sentiment was echoed at the “Unlocking Funding: Bridging the Liquidity Gap and the Battery Market” panel, where YJ Lee, director and co-fund manager at Arcane Capital Advisers offered advice for junior miners.“There's very little financing available. So the junior miners … have to really cut the corporate costs, keep that as low as possible. But the operations must go on. They must continue drilling. They must continue developing. Because the next up cycle, I believe, is just around the corner.”

Don’t forget to follow us @INN_Resource for real-time updates!Securities Disclosure: I, Georgia Williams, hold no direct investment interest in any company mentioned in this article.",https://www.nasdaq.com/articles/3-key-themes-fastmarkets-2025-lithium-supply-battery-raw-materials-event,"Wed, 02 Jul 2025 21:00:00 +0000",https://www.nasdaq.com/feed/rssoutbound?category=Commodities
Meeka Metals Reports First Gold Pour at Murchison Project,"Meeka Metals (ASX:MEK) has poured the first gold at its flagship Murchison project in Western Australia. The pour happened on Tuesday (July 1), and in a Wednesday (July 2) press release, the company said the project’s production is in line with schedule, happening within 12 months of breaking ground.Murchison sits near several multimillion-ounce gold mines and hosts a large, high-grade resource of 1.2 million ounces at 3 grams per tonne (g/t) gold on granted mining leases. Meeka released a definitive feasibility study in December 2024, outlining a 10 year production plan for the project. Up to 76,000 ounces per annum are targeted, with an average of 65,000 ounces approximated for the first seven years.The study also focused on restarting the Andy Well mill, with site activity commencing during Q1 2025. Process plant commissioning followed in the next quarter, with the first gold pour following its projected schedule of mid 2025.“It is an impressive achievement by the team to deliver first gold on time and within 12 months of breaking ground at the Murchison,” said Managing Director Tim Davidson. “We are now focused on ramping up gold production toward our targeted 80 kilo ounces per annum with the arrival of the third dig fleet and expanded open pit mining plan underway.”Drilling at Turnberry Central, part of Murchison, was announced on June 10. Results include 30 metres at 1.09 g/t gold from 29 meters, including 9 meters at 2.45 g/t gold.The company announced in mid-June that process plant commissioning was underway at Murchison.Underground mining at Murchison’s Andy Well mill is set to begin in the third quarter of 2025. As per a company presentation shared by Meeka on June 19, Andy Well hosts a mineral resource of 505,000 ounces at 8.6 g/t gold.First ore from Andy Well is expected in the third quarter of this year.Don’t forget to follow us @INN_Australia for real-time news updates!Securities Disclosure: I, Gabrielle de la Cruz, hold no direct investment interest in any company mentioned in this article.",https://www.nasdaq.com/articles/meeka-metals-reports-first-gold-pour-murchison-project,"Wed, 02 Jul 2025 20:55:00 +0000",https://www.nasdaq.com/feed/rssoutbound?category=Commodities
TX Makes Bullish Cross Above Critical Moving Average,"In trading on Wednesday, shares of Ternium S A (Symbol: TX) crossed above their 200 day moving average of $31.12, changing hands as high as $31.82 per share.  Ternium S A shares are currently trading up about 4.2% on the day.  The chart below shows the one year performance of TX",https://www.nasdaq.com/articles/tx-makes-bullish-cross-above-critical-moving-average-0,"Wed, 02 Jul 2025 20:39:22 +0000",https://www.nasdaq.com/feed/rssoutbound?category=Commodities
Crude Oil Rises As Iran Challenges IAEA's Powers To Inspect,"(RTTNews) - Crude oil made sharp gains on Wednesday, even as the Israel-Iran ceasefire holds, as Iran has challenged the IAEA's power to inspect its nuclear sites without its security council's approval. A falling US dollar also offered support for oil.",https://www.nasdaq.com/articles/crude-oil-rises-iran-challenges-iaeas-powers-inspect,"Wed, 02 Jul 2025 18:56:14 +0000",https://www.nasdaq.com/feed/rssoutbound?category=Commodities
Gold Gains On Budgetary Worries And Trade Concerns,"(RTTNews) - Gold extended gains on Wednesday, driven by weakness in the US dollar which is losing value due to ongoing US fiscal concerns and global trade uncertainty.",https://www.nasdaq.com/articles/gold-gains-budgetary-worries-and-trade-concerns,"Wed, 02 Jul 2025 18:03:45 +0000",https://www.nasdaq.com/feed/rssoutbound?category=Commodities
U.S. Crude Oil Inventories Unexpectedly Rise By 3.8 Million Barrels,(RTTNews) - The Energy Information Administration released a report on Wednesday showing an unexpected increase by U.S. crude oil inventories in the week ended June 27th.,https://www.nasdaq.com/articles/us-crude-oil-inventories-unexpectedly-rise-38-million-barrels,"Wed, 02 Jul 2025 15:39:26 +0000",https://www.nasdaq.com/feed/rssoutbound?category=Commodities
Pre-Markets Open in the Red After Independence Day Weekend,Pre-Markets Open in the Red After Independence Day Weekend.,https://www.nasdaq.com/articles/pre-markets-open-red-after-independence-day-weekend,"Mon, 07 Jul 2025 15:03:00 +0000",https://www.nasdaq.com/feed/rssoutbound?category=Economy
Nonfarm Payrolls Exceed Estimates in June,Nonfarm Payrolls Exceed Estimates in June.,https://www.nasdaq.com/articles/nonfarm-payrolls-exceed-estimates-june,"Thu, 03 Jul 2025 15:03:00 +0000",https://www.nasdaq.com/feed/rssoutbound?category=Economy
Private Payrolls Unexpectedly Came in Negative in June,Private Payrolls Unexpectedly Came in Negative in June.,https://www.nasdaq.com/articles/private-payrolls-unexpectedly-came-negative-june,"Wed, 02 Jul 2025 14:39:00 +0000",https://www.nasdaq.com/feed/rssoutbound?category=Economy
Economic Data Deluge This Week,Economic Data Deluge This Week.,https://www.nasdaq.com/articles/economic-data-deluge-week,"Tue, 01 Jul 2025 14:50:00 +0000",https://www.nasdaq.com/feed/rssoutbound?category=Economy
Wall Street Set to Close Strong a Turbulent 1H 2025,Wall Street Set to Close Strong a Turbulent 1H 2025.,https://www.nasdaq.com/articles/wall-street-set-close-strong-turbulent-1h-2025,"Mon, 30 Jun 2025 14:52:00 +0000",https://www.nasdaq.com/feed/rssoutbound?category=Economy
Value Alert: 3 High-Yield Stocks Trading at 52-Week Lows,"Stocks trading at or near their 52-week lows offer&nbsp;value and higher-than-average yields that investors can capitalize on. The risk is that stock trading at or near their 52-week lows also often move on to set lower lows, undermining the opportunity.
This is a look at three high-",https://www.nasdaq.com/articles/value-alert-3-high-yield-stocks-trading-52-week-lows,"Sat, 28 Jun 2025 13:37:00 +0000",https://www.nasdaq.com/feed/rssoutbound?category=Economy
PCE Inflation Increased In Line With Expectations,PCE Inflation Increased In Line With Expectations,https://www.nasdaq.com/articles/pce-inflation-increased-line-expectations,"Fri, 27 Jun 2025 15:02:00 +0000",https://www.nasdaq.com/feed/rssoutbound?category=Economy
Jobless Claims Decreased More Than Expected,Jobless Claims Decreased More Than Expected,https://www.nasdaq.com/articles/jobless-claims-decreased-more-expected,"Thu, 26 Jun 2025 15:13:00 +0000",https://www.nasdaq.com/feed/rssoutbound?category=Economy
Markets Await New Home Sales Data,Markets Await New Home Sales Data,https://www.nasdaq.com/articles/markets-await-new-home-sales-data-1,"Wed, 25 Jun 2025 14:54:00 +0000",https://www.nasdaq.com/feed/rssoutbound?category=Economy
Home Prices Decreased More Than Expected,Home Prices Decreased More Than Expected,https://www.nasdaq.com/articles/home-prices-decreased-more-expected,"Tue, 24 Jun 2025 14:09:00 +0000",https://www.nasdaq.com/feed/rssoutbound?category=Economy
3 Blockchain Stocks to Profit in a Decentralized World,"In his 2019 book, Life After Google, George Gilder argues that the centralized internet is on the brink of collapse. It&rsquo;s a bold claim, but one that a futurist like Gilder addresses by pointing out the flaws of centralized systems. These include:",https://www.nasdaq.com/articles/3-blockchain-stocks-profit-decentralized-world,"Tue, 24 Jun 2025 11:37:00 +0000",https://www.nasdaq.com/feed/rssoutbound?category=Economy
Pre-Markets Flat to Start a Fresh Trading Week,Pre-Markets Flat to Start a Fresh Trading Week,https://www.nasdaq.com/articles/pre-markets-flat-start-fresh-trading-week,"Mon, 23 Jun 2025 14:57:00 +0000",https://www.nasdaq.com/feed/rssoutbound?category=Economy
JPMorgan Chase: The Financial Fortress Built for Today's Investor,"It can be challenging to grasp the sheer scale of JPMorgan Chase & Co. (NYSE: JPM). As the largest bank in the United States, it manages a balance sheet of over $4 trillion.
In today's market, investors face a challenging environment of stubborn inflation and global uncertainty",https://www.nasdaq.com/articles/jpmorgan-chase-financial-fortress-built-todays-investor,"Mon, 23 Jun 2025 13:05:00 +0000",https://www.nasdaq.com/feed/rssoutbound?category=Economy
Philly Fed Ticks in Lower Than Expected,Philly Fed Ticks in Lower Than Expected.,https://www.nasdaq.com/articles/philly-fed-ticks-lower-expected,"Fri, 20 Jun 2025 14:48:00 +0000",https://www.nasdaq.com/feed/rssoutbound?category=Economy
Coinbase Stock Pops as Senate Passes GENIUS Stablecoin Bill,"Exciting news just rose to the forefront for cryptocurrency stock Coinbase Global (NASDAQ: COIN). On June 18, shares of Coinbase surged 16%. The United States government took an important step that benefits the firm&rsquo;s future. The U.S. Senate passed the Guiding and Establishing",https://www.nasdaq.com/articles/coinbase-stock-pops-senate-passes-genius-stablecoin-bill,"Thu, 19 Jun 2025 19:26:00 +0000",https://www.nasdaq.com/feed/rssoutbound?category=Economy
Centene's Punishment Overly Done - Contrarian Buy At A Deep Discount,,https://seekingalpha.com/article/4799827-centene-punishment-overly-done-contrarian-buy-deep-discount?source=feed_all_articles,"Tue, 08 Jul 2025 10:00:00 -0400",https://seekingalpha.com/feed.xml
The Dollar's Demise Is Greatly Exaggerated,,https://seekingalpha.com/article/4799893-dollar-demise-is-greatly-exaggerated?source=feed_all_articles,"Tue, 08 Jul 2025 10:00:00 -0400",https://seekingalpha.com/feed.xml
Altria's Dividend Is Aging Like Fine Wine,,https://seekingalpha.com/article/4799885-altria-dividend-aging-like-fine-wine?source=feed_all_articles,"Tue, 08 Jul 2025 09:56:55 -0400",https://seekingalpha.com/feed.xml
Valley National Bancorp: Upgrading 8.2% Yielding Preferred Shares On Better Performance,,https://seekingalpha.com/article/4799884-valley-national-bancorp-upgrading-8-2-percent-yielding-preferred-shares-better-performance?source=feed_all_articles,"Tue, 08 Jul 2025 09:51:36 -0400",https://seekingalpha.com/feed.xml
ClearBridge Investments Q2 2025 Commentary,,https://seekingalpha.com/article/4799896-clearbridge-investments-q2-2025-commentary?source=feed_all_articles,"Tue, 08 Jul 2025 09:50:00 -0400",https://seekingalpha.com/feed.xml
Are Tariffs No Big Deal?,,https://seekingalpha.com/article/4799882-are-tariffs-no-big-deal?source=feed_all_articles,"Tue, 08 Jul 2025 09:47:17 -0400",https://seekingalpha.com/feed.xml
Adobe: Overblown Fears Create Buy Opportunity,,https://seekingalpha.com/article/4799881-adobe-overblown-fears-create-buy-opportunity?source=feed_all_articles,"Tue, 08 Jul 2025 09:46:33 -0400",https://seekingalpha.com/feed.xml
Beyond Tesla's Hood: The Variable Influencing Half Of Its Value,,https://seekingalpha.com/article/4799880-beyond-tesla-hood-variable-influencing-half-its-value?source=feed_all_articles,"Tue, 08 Jul 2025 09:45:22 -0400",https://seekingalpha.com/feed.xml
Hims & Hers Health: Unlocking A $6 Billion Future,,https://seekingalpha.com/article/4799879-hims-and-hers-health-unlocking-a-6-billion-future?source=feed_all_articles,"Tue, 08 Jul 2025 09:44:48 -0400",https://seekingalpha.com/feed.xml
How Bad Were U.S. Tariffs For The Liquidity Of Corporate Bonds?,,https://seekingalpha.com/article/4799888-how-bad-were-us-tariffs-for-liquidity-of-corporate-bonds?source=feed_all_articles,"Tue, 08 Jul 2025 09:30:00 -0400",https://seekingalpha.com/feed.xml
Microsoft: Risks That The Market Does Not Yet See,,https://seekingalpha.com/article/4799875-microsoft-risks-that-the-market-does-not-yet-see?source=feed_all_articles,"Tue, 08 Jul 2025 09:23:37 -0400",https://seekingalpha.com/feed.xml
Mindless Flows Are Not Loss Protection,,https://seekingalpha.com/article/4799876-mindless-flows-not-loss-protection?source=feed_all_articles,"Tue, 08 Jul 2025 09:23:00 -0400",https://seekingalpha.com/feed.xml
"Veeva Systems: Solid Performance, Terrible Price",,https://seekingalpha.com/article/4799874-veeva-systems-solid-performance-terrible-price?source=feed_all_articles,"Tue, 08 Jul 2025 09:19:54 -0400",https://seekingalpha.com/feed.xml
PepsiCo: You May Not Find A Better Opportunity To Buy (Rating Upgrade),,https://seekingalpha.com/article/4799873-pepsico-may-not-find-better-opportunity-to-buy?source=feed_all_articles,"Tue, 08 Jul 2025 09:18:30 -0400",https://seekingalpha.com/feed.xml
A Cash-Based Case To Give Teradata Corporation A Second Chance,,https://seekingalpha.com/article/4799871-a-cash-based-case-to-give-teradata-corporation-a-second-chance?source=feed_all_articles,"Tue, 08 Jul 2025 09:15:00 -0400",https://seekingalpha.com/feed.xml
Your Golden Years Need Gold Standards: My Top 3 Retirement Picks,,https://seekingalpha.com/article/4799665-your-golden-years-need-gold-standards-my-top-3-retirement-picks?source=feed_all_articles,"Tue, 08 Jul 2025 09:15:00 -0400",https://seekingalpha.com/feed.xml
The Manitowoc Company's Strong Upside Isn't Over,,https://seekingalpha.com/article/4799868-the-manitowoc-company-strong-upside-isnt-over?source=feed_all_articles,"Tue, 08 Jul 2025 09:06:48 -0400",https://seekingalpha.com/feed.xml
Fundsmith Equity Fund 2025 Semi-Annual Letter To Shareholders,,https://seekingalpha.com/article/4799883-fundsmith-equity-fund-2025-semi-annual-letter-to-shareholders?source=feed_all_articles,"Tue, 08 Jul 2025 09:05:00 -0400",https://seekingalpha.com/feed.xml
Rexford Industrial Realty: No End Of Pain In Sight,,https://seekingalpha.com/article/4799870-rexford-industrial-reit-no-end-of-pain-in-sight?source=feed_all_articles,"Tue, 08 Jul 2025 09:00:00 -0400",https://seekingalpha.com/feed.xml
Market Outlook: Confidence Slightly Outweighs Concern,,https://seekingalpha.com/article/4799878-market-outlook-confidence-slightly-outweighs-concern?source=feed_all_articles,"Tue, 08 Jul 2025 09:00:00 -0400",https://seekingalpha.com/feed.xml
Stock Picks From Seeking Alpha's June 2025 New Analysts,,https://seekingalpha.com/article/4799471-stock-picks-from-seeking-alphas-june-2025-new-analysts?source=feed_all_articles,"Tue, 08 Jul 2025 09:00:00 -0400",https://seekingalpha.com/feed.xml
Peyto: Natural Gas Prices Get A Boost,,https://seekingalpha.com/article/4799865-peyto-natural-gas-prices-get-a-boost?source=feed_all_articles,"Tue, 08 Jul 2025 08:47:41 -0400",https://seekingalpha.com/feed.xml
ULTY: Different Strategy From YieldMax With Weekly Distributions But A Lot Of What-Ifs,,https://seekingalpha.com/article/4799462-ulty-different-strategy-from-yieldmax-weekly-distributions-what-ifs?source=feed_all_articles,"Tue, 08 Jul 2025 08:45:00 -0400",https://seekingalpha.com/feed.xml
RWL: A Revenue Bias As A Defensive Approach,,https://seekingalpha.com/article/4799864-rwl-a-revenue-bias-as-a-defensive-approach?source=feed_all_articles,"Tue, 08 Jul 2025 08:44:23 -0400",https://seekingalpha.com/feed.xml
"JQC Provides High-Yield Exposure, But Underperforms Peer Strategies",,https://seekingalpha.com/article/4799863-jqc-provides-high-yield-exposure-but-underperforms-peer-strategies?source=feed_all_articles,"Tue, 08 Jul 2025 08:44:17 -0400",https://seekingalpha.com/feed.xml
VEE:CA: Buy Emerging Markets Ahead Of Global Trade Realignments,,https://seekingalpha.com/article/4799862-veeca-buy-emerging-markets-ahead-of-global-trade-realignments?source=feed_all_articles,"Tue, 08 Jul 2025 08:41:46 -0400",https://seekingalpha.com/feed.xml
Rebound Outlook Softens For U.S. Q2 GDP Nowcast,,https://seekingalpha.com/article/4799877-rebound-outlook-softens-for-us-q2-gdp-nowcast?source=feed_all_articles,"Tue, 08 Jul 2025 08:38:00 -0400",https://seekingalpha.com/feed.xml
"SoFi Technologies: No FOMO, Fundamentals Only",,https://seekingalpha.com/article/4799824-sofi-technologies-stock-strong-fundamentals-attractive-valuation?source=feed_all_articles,"Tue, 08 Jul 2025 08:30:31 -0400",https://seekingalpha.com/feed.xml
This Market Is As Good As It Gets For Collaring Stocks And ETFs Like SPY And QQQ,,https://seekingalpha.com/article/4799749-this-market-as-good-as-it-gets-for-collaring-stocks-and-etfs-like-spy-and-qqq?source=feed_all_articles,"Tue, 08 Jul 2025 08:30:00 -0400",https://seekingalpha.com/feed.xml
Netflix Q2 Earnings Preview:  Recent Price Spike Makes Me Cautious (Rating Downgrade),,https://seekingalpha.com/article/4799829-netflix-q2-earnings-preview-recent-price-spike-makes-me-cautious?source=feed_all_articles,"Tue, 08 Jul 2025 08:30:00 -0400",https://seekingalpha.com/feed.xml
"Stocks making big midday moves: Tesla, Uber, Royal Gold, Stellantis, WNS and more",These are some of the stocks posting the largest moves in midday trading Monday.,https://www.cnbc.com/2025/07/07/stocks-making-big-midday-moves-tesla-uber-stellantis-wns-and-more.html,"Mon, 07 Jul 2025 15:54:56 GMT",https://search.cnbc.com/rs/search/combinedcms/view.xml?partnerId=wrss01&id=20409666
"Stocks making the biggest premarket moves: Tesla, Geo Group, Molina Healthcare, SolarEdge Technologies and more",These are the stocks posting the largest moves in the premarket.,https://www.cnbc.com/2025/07/07/stocks-making-the-biggest-premarket-moves-ttsla-geo-moh-sedg.html,"Mon, 07 Jul 2025 15:30:56 GMT",https://search.cnbc.com/rs/search/combinedcms/view.xml?partnerId=wrss01&id=20409666
"Stocks making the biggest moves midday: First Solar, CrowdStrike, Datadog, Robinhood and more",Check out some of the stocks posting the largest moves in midday trading.,https://www.cnbc.com/2025/07/03/stocks-making-the-biggest-moves-midday-fslr-crwd-ddog-hood.html,"Thu, 03 Jul 2025 15:16:42 GMT",https://search.cnbc.com/rs/search/combinedcms/view.xml?partnerId=wrss01&id=20409666
"Stocks making the biggest moves premarket: Synopsys, Tripadvisor, Datadog, Robinhood and more",These are some of the stocks posting the largest moves in early trading.,https://www.cnbc.com/2025/07/03/stocks-making-the-biggest-moves-premarket-snps-trip-ddog-hood-and-more.html,"Thu, 03 Jul 2025 13:03:48 GMT",https://search.cnbc.com/rs/search/combinedcms/view.xml?partnerId=wrss01&id=20409666
